{
    "fleet": "UCM",
    "name": "Munitions Platform",
    "size": "Small",
    "points": 60,
    "base_size": 30,
    "profile": {
        "Scan": 6,
        "Sig": 4,
        "Hull": 8,
        "ES": "3+",
        "KS": "5+",
        "BS": "-",
        "G": "1",
        "Special": []
    },
    "weapons": [],
    "load": [
        {
            "Load": "Medium Torpedo",
            "Launch": 2,
            "Special": [
                "Limited-4"
            ]
        }
    ]
}