{
    "fleet": "Scourge",
    "name": "Nematocyst",
    "size": "Small",
    "points": 65,
    "base_size": 30,
    "profile": {
        "Scan": 12,
        "Sig": 4,
        "Hull": 8,
        "ES": "3+",
        "KS": "4+",
        "BS": "-",
        "G": "1",
        "Special": []
    },
    "weapons": [
        {
            "Name": "Volcano Lance",
            "Arc": "F/S/R",
            "Att": 3,
            "Lock": "3+",
            "DMG": 2,
            "Type": "E",
            "Special": [
                "Bloom-1",
                "Burnthrough-1",
                "Flash-1"
            ]
        }
    ],
    "load": []
}