{
    "fleet": "Shaltari",
    "name": "Shuriken",
    "size": "Large",
    "points": 150,
    "base_size": 50,
    "profile": {
        "Scan": 12,
        "Sig": 6,
        "Hull": 24,
        "ES": "4+",
        "KS": "4+",
        "BS": "-",
        "G": "1",
        "Special": [
            "Shield-4+"
        ]
    },
    "weapons": [
        {
            "Name": "Disintegrator Bank",
            "Arc": "*",
            "Att": 8,
            "Lock": "3+",
            "DMG": 1,
            "Type": "E",
            "Special": [
                "Volley-5"
            ],
            "Rule": "Instead of the normal Arcs, Shaltari Shurikens have their own Arcs. A Shuriken has 5 Arcs, each 72 degrees. The easiest way to define these Arcs is to follow the lines of adjacent vertical vanes, measured from the flight stand as normal. Follow these arcs when attacking instead of the normal rules for Arcs.\nWhen you assign targets to this weapon, you may only use each Arc once."
        }
    ],
    "load": []
}